{
  "$schema": "https://json-schema.org/draft/2020-12/schema",
  "$id": "tasks.schema.json",
  "title": "Tasks",
  "description": "One project's tasks: epics hold features, a feature's plan holds tickets, a ticket holds subtickets. An item is approved when the user approved it or, with children, when all of them are. An item can't be built before the items in its `blockedBy`, nor before those of its parents, are done; it can be approved anyway, and then waits. The user may also cancel an item (it won't be built), leave notes on it, and answer a feature's open questions, all in the viewer. Ids never change: a new feature or ticket takes the next number under its parent (TK-3.2 is TK-3's second ticket, TK-3.2.1 that ticket's first subticket). Every title says what is done, verb first: Add, Update, Replace, Move, Split, Merge, Delete, or Fix <what goes wrong> when <it happens>. Text is markdown: `code`, **bold**, links; an id (TK-3, GW-13.2) links to its page in the viewer. A feature's or a ticket's `description` may also hold paragraphs (a blank line between), `- ` lists and ``` fenced code: the interfaces and types a ticket defines.",
  "type": "object",
  "required": ["repo", "prefix", "epics"],
  "additionalProperties": false,
  "properties": {
    "$schema": {
      "type": "string"
    },
    "repo": {
      "$ref": "#/$defs/repo",
      "description": "The repository these tasks belong to."
    },
    "prefix": {
      "type": "string",
      "pattern": "^[A-Z]+$",
      "description": "The id prefix of every feature and ticket in this file: TK (tickets), GW (gateway), BH (bh), IC (items-core), AU (auth), IA (items-app)."
    },
    "intro": {
      "type": "array",
      "items": {
        "$ref": "#/$defs/block"
      },
      "description": "What this list is, and notes that hold for all of it."
    },
    "epics": {
      "type": "array",
      "items": {
        "$ref": "#/$defs/epic"
      }
    }
  },
  "$defs": {
    "repo": {
      "type": "string",
      "enum": [
        "tickets",
        "bh",
        "gateway",
        "live gateway",
        "items-core",
        "items-infrastructure",
        "medialib",
        "signals",
        "cv",
        "wallet-passes",
        "icon-editor",
        "session-board",
        "auth",
        "items-app",
        "gcp"
      ],
      "description": "A repository (`../<name>`); \"live gateway\" is the running gateway on this machine (its bh page, its stored stacks, its deploys); \"gcp\" is Google Cloud and its consoles. bh's packages are copied into the apps after a release, never edited under their `packages/bh/`."
    },
    "title": {
      "type": "string",
      "minLength": 1,
      "description": "What is done, verb first: \"Add submenus to `Menu`\", \"Fix duplicate option ids when two `Select`s share a page\"."
    },
    "epic": {
      "type": "object",
      "required": ["id", "title", "features"],
      "additionalProperties": false,
      "properties": {
        "id": {
          "type": "string",
          "pattern": "^E\\d+$"
        },
        "title": {
          "$ref": "#/$defs/title"
        },
        "description": {
          "type": "string"
        },
        "blockedBy": {
          "$ref": "#/$defs/blockedBy"
        },
        "notes": {
          "$ref": "#/$defs/notes"
        },
        "features": {
          "type": "array",
          "items": {
            "$ref": "#/$defs/feature"
          }
        }
      }
    },
    "feature": {
      "type": "object",
      "required": ["id", "title", "status", "where"],
      "additionalProperties": false,
      "properties": {
        "id": {
          "type": "string",
          "pattern": "^[A-Z]+-\\d+$"
        },
        "title": {
          "$ref": "#/$defs/title"
        },
        "description": {
          "type": "string",
          "description": "What it is, in a sentence or two."
        },
        "status": {
          "type": "string",
          "enum": ["Not planned", "Planning", "Planned", "Designed", "In progress", "Done"],
          "description": "Not planned: written down only. Planning: being planned now. Planned: a plan, ready to build. Designed: a design exists (a feature with a `design` and a plan stays Planned). In progress. Done."
        },
        "waitingOn": {
          "type": "array",
          "minItems": 1,
          "items": {
            "type": "string"
          },
          "description": "What it waits for that isn't an item, in words: \"your choices (below)\". Items it waits for go in `blockedBy`."
        },
        "blockedBy": {
          "$ref": "#/$defs/blockedBy"
        },
        "statusNote": {
          "type": "string",
          "description": "A word on the status: the commit it landed in, what's left."
        },
        "approved": {
          "type": "boolean",
          "description": "The user approved it. Kept only on an item with no children: a feature with a plan, a ticket with subtickets and every epic are approved when all their children are, which is worked out, never stored. The viewer's Approve sets it (approving a parent sets every item under it)."
        },
        "cancelled": {
          "$ref": "#/$defs/cancelled"
        },
        "notes": {
          "$ref": "#/$defs/notes"
        },
        "where": {
          "type": "array",
          "minItems": 1,
          "items": {
            "$ref": "#/$defs/where"
          },
          "description": "Where it's built, in order."
        },
        "today": {
          "$ref": "#/$defs/block",
          "description": "What's there today, with paths and counts."
        },
        "stays": {
          "$ref": "#/$defs/block",
          "description": "What it leaves as it is, and why."
        },
        "rule": {
          "$ref": "#/$defs/block",
          "description": "A rule the work keeps."
        },
        "chosen": {
          "$ref": "#/$defs/block",
          "description": "What's decided; \"your answer\" marks the user's own decisions."
        },
        "chosenOn": {
          "type": "string",
          "pattern": "^\\d{4}-\\d{2}-\\d{2}$",
          "description": "When it was chosen."
        },
        "openChoices": {
          "type": "array",
          "minItems": 1,
          "items": {
            "$ref": "#/$defs/choice"
          },
          "description": "Questions the user answers, each with its options. The viewer shows them under the feature, where the user picks an option or writes their own (`answer`). A session folds an answered one into `chosen` and the plan, then removes it; it never answers one itself."
        },
        "design": {
          "$ref": "#/$defs/block",
          "description": "The design: a link and what it adds."
        },
        "plan": {
          "type": "array",
          "items": {
            "$ref": "#/$defs/ticket"
          },
          "description": "The tickets, in order. None while it is not planned."
        }
      }
    },
    "ticket": {
      "type": "object",
      "required": ["id", "title", "done"],
      "additionalProperties": false,
      "properties": {
        "id": {
          "type": "string",
          "pattern": "^[A-Z]+-\\d+(\\.\\d+)+$"
        },
        "title": {
          "$ref": "#/$defs/title"
        },
        "description": {
          "type": "string",
          "description": "What it does."
        },
        "where": {
          "type": "array",
          "minItems": 1,
          "items": {
            "$ref": "#/$defs/where"
          }
        },
        "done": {
          "type": "boolean"
        },
        "blockedBy": {
          "$ref": "#/$defs/blockedBy"
        },
        "approved": {
          "type": "boolean",
          "description": "The user approved it. Kept only on an item with no children: a feature with a plan, a ticket with subtickets and every epic are approved when all their children are, which is worked out, never stored. The viewer's Approve sets it (approving a parent sets every item under it)."
        },
        "cancelled": {
          "$ref": "#/$defs/cancelled"
        },
        "notes": {
          "$ref": "#/$defs/notes"
        },
        "byYou": {
          "type": "boolean",
          "description": "The user does it: console access, an external account, credentials, a go/no-go."
        },
        "subtickets": {
          "type": "array",
          "items": {
            "$ref": "#/$defs/ticket"
          }
        }
      }
    },
    "blockedBy": {
      "type": "array",
      "minItems": 1,
      "items": {
        "$ref": "#/$defs/blocker"
      },
      "description": "What must be done first. Its children wait on these too, so they aren't repeated below it. Name the most specific item (a ticket, not its feature, when only the ticket is needed); never the item's own parent or child; no cycles."
    },
    "blocker": {
      "type": "object",
      "required": ["id", "why"],
      "additionalProperties": false,
      "properties": {
        "id": {
          "type": "string",
          "pattern": "^[A-Z]+(-\\d+(\\.\\d+)*|/E\\d+)$",
          "description": "A feature or ticket (TK-2.2, GW-13), or an epic as prefix/id (TK/E4), in any file."
        },
        "why": {
          "type": "string",
          "minLength": 1,
          "description": "What it needs from it, in a few words: \"uses `Select`'s option groups\"."
        }
      }
    },
    "cancelled": {
      "type": "boolean",
      "description": "The user cancelled it: it won't be built. Kept only on an item with no children, like `approved`, and never beside it; a parent is cancelled when all its children are. The viewer's Cancel sets it (cancelling a parent cancels every item under it)."
    },
    "notes": {
      "type": "array",
      "minItems": 1,
      "items": {
        "$ref": "#/$defs/note"
      },
      "description": "Words on it, oldest first, written in the viewer: the user's, and the planner session's replies (`by: \"claude\"`). A session reads the user's as their words about the item."
    },
    "note": {
      "type": "object",
      "required": ["at", "text"],
      "additionalProperties": false,
      "properties": {
        "at": {
          "type": "string",
          "pattern": "^\\d{4}-\\d{2}-\\d{2}T\\d{2}:\\d{2}:\\d{2}(\\.\\d+)?Z$",
          "description": "When it was written, in UTC; also the note's key."
        },
        "by": {
          "enum": ["claude"],
          "description": "Who wrote it, when it isn't the user: `claude` is the planner session, replying."
        },
        "quote": {
          "type": "string",
          "minLength": 1,
          "description": "The fragment of the item's description the note is about, as the user selected it (whitespace collapsed). A reply about the same fragment carries the same quote."
        },
        "nth": {
          "type": "number",
          "description": "Which place of the quote it is, from 0, when the description has it more than once."
        },
        "text": {
          "type": "string",
          "minLength": 1
        },
        "seen": {
          "type": "string",
          "pattern": "^\\d{4}-\\d{2}-\\d{2}T\\d{2}:\\d{2}:\\d{2}(\\.\\d+)?Z$",
          "description": "On the user's notes: when the planner took it in (replied, acted on it, or just read it). A note without it is still to be read."
        },
        "closed": {
          "type": "string",
          "pattern": "^\\d{4}-\\d{2}-\\d{2}T\\d{2}:\\d{2}:\\d{2}(\\.\\d+)?Z$",
          "description": "When the user closed its thread (the item's own notes, or one quoted fragment's). A thread is closed while all its notes are; the viewer shows it as one line."
        }
      }
    },
    "choice": {
      "type": "object",
      "required": ["question", "options"],
      "additionalProperties": false,
      "properties": {
        "question": {
          "type": "string",
          "minLength": 1,
          "description": "The question, whole: it names its subject, so it reads on its own."
        },
        "context": {
          "type": "string",
          "description": "What helps to answer it."
        },
        "options": {
          "type": "array",
          "minItems": 2,
          "items": {
            "type": "string",
            "minLength": 1
          },
          "description": "The answers to pick from, each whole."
        },
        "recommended": {
          "type": "number",
          "description": "The index in `options` of the recommended answer."
        },
        "notes": {
          "$ref": "#/$defs/notes",
          "description": "The talk about the question: an answer of the user's that asked something instead (moved here when the planner replied), and the planner's replies."
        },
        "answer": {
          "type": "string",
          "minLength": 1,
          "description": "The user's answer: one of the options as written, or their own words. A session folds it into `chosen` and the plan, or, when it asks something, moves it into `notes` with a reply."
        },
        "answeredOn": {
          "type": "string",
          "pattern": "^\\d{4}-\\d{2}-\\d{2}$"
        }
      }
    },
    "where": {
      "type": "object",
      "required": ["repo", "part"],
      "additionalProperties": false,
      "properties": {
        "repo": {
          "$ref": "#/$defs/repo"
        },
        "part": {
          "type": "string",
          "minLength": 1,
          "description": "The part of the repository: a package, an app, a path."
        }
      }
    },
    "block": {
      "description": "Text: a paragraph, a list, or a paragraph with a list under it.",
      "oneOf": [
        {
          "type": "string"
        },
        {
          "type": "array",
          "items": {
            "$ref": "#/$defs/item"
          }
        },
        {
          "type": "object",
          "required": ["text", "items"],
          "additionalProperties": false,
          "properties": {
            "text": {
              "type": "string"
            },
            "items": {
              "type": "array",
              "items": {
                "$ref": "#/$defs/item"
              }
            }
          }
        }
      ]
    },
    "item": {
      "description": "A list item: its text, or its text with a list under it.",
      "oneOf": [
        {
          "type": "string"
        },
        {
          "type": "object",
          "required": ["text", "items"],
          "additionalProperties": false,
          "properties": {
            "text": {
              "type": "string"
            },
            "items": {
              "type": "array",
              "items": {
                "$ref": "#/$defs/item"
              }
            }
          }
        }
      ]
    }
  }
}
