{
  "$schema": "./tasks.schema.json",
  "repo": "items-core",
  "prefix": "IC",
  "intro": [
    "items-core's deployment list. Since 2026-10-16 it deploys items-core on the gateway (E4): you dropped Google Cloud and Terraform, and the Google Cloud plan (E2, Milestone 3 \"Deploy and accept in GCP\" of the worker migration plan `../items-core/docs/superpowers/plans/2026-09-22-worker-migration-finish.md`, which by its own rule stays uncommitted in items-core's main checkout) has its open tickets cancelled, each naming where its work went. The runbooks are committed in items-core: `DEPLOY.md`, `docs/workflow/deploy.md` and `WORKER.md`; they describe Google Cloud until IC-17.3 and IC-19 rewrite them. E3 holds what the older TASK tickets left open.",
    "Where it stands: Milestones 1 and 2 landed on items-core's `bbendeliani/detection` on 2026-09-22 and 2026-09-23, and none of it is deployed. items-core's `main` (`b1ccebf8`, 2026-09-12) still has the HTTP worker; TK-66.4 merges `bbendeliani/detection` into it. The Terraform on items-infrastructure's local branch `bbendeliani/direct-worker` (six commits, never pushed or applied) is left as it is.",
    {
      "text": "**Topology on the gateway (E4):**",
      "items": [
        "**API** (`api`, items-core's `@bw/gateway`): the console API and the consumer API (by `Host`), schedule firing, the sweep and `run_events` partition upkeep, in one always-on container. Its migrations run as a job before each deploy.",
        "**Console** (`console`): nginx serving the console's pages and passing `/api` to the API.",
        "**Worker and browser** (`worker`, `browser`): one direct worker, `gw-1`, reaching Chrome over CDP by the browser's service name on the stack's network.",
        "**Workers connect to Postgres directly**, as the restricted `aitems_worker` role, which a job makes before each deploy. They hold no token, have no API URL, listen for no inbound traffic and run no DDL. A worker joins the fleet the first time it starts, under its `WORKER_NAME`.",
        "**Data**: the gateway's shared Postgres (a database and owner role for the stack, dumped each night); page content and screenshots on volumes, the content one shared by the API and the worker; workflow blobs in Postgres.",
        "**Addresses** through the gateway's Caddy, on the LAN and over Tailscale only.",
        "Remote machines provide browsers or proxies only (the plan's rule)."
      ]
    },
    "A ticket marked `byYou` is yours: the live gateway, an external account, credentials, or a go/no-go. The others can be written (code or docs) for your review.",
    {
      "text": "Watch out for:",
      "items": [
        "**One transport.** No HTTP worker ever reaches the gateway's database. There is no fallback and no transport switch.",
        "**Workers never run DDL.** The API creates the weekly partitions. A worker refuses to boot without next week's, and stops claiming while any of the coming seven days is uncovered.",
        "**Leases are fenced by epoch.** A killed worker hands nothing back: its leases lapse after 30 seconds and a new boot reclaims the runs from the durable log. A worker whose lease was taken over has its writes refused.",
        "**The shared Postgres is every stack's.** By the cloud budget's terms items-core takes up to 44 connections while its API rolls out, operators' reserve included, and a second worker adds 10; IC-20.1 measures what the other stacks leave.",
        "**A stop is sticky.** A stopped worker exits again on every start until its fleet row is deleted. `restart: on-failure` leaves it down, and a deploy fails its check meanwhile.",
        "**`NOLOGIN` doesn't end live sessions.** To cut a worker off at the database, also `pg_terminate_backend` its `items-worker:<bootId>` sessions.",
        "**Storage settings must match** on the API and the worker: `STORAGE_PROVIDER`, `CONTENT_STORAGE_DIR` on the volume they share, and `WORKFLOW_BLOB_STORAGE_PROVIDER`.",
        "**The clock check stays at 5 s.** Fix a drifting clock rather than setting `WORKER_ALLOW_UNSAFE_CLOCK_SKEW`, and never use that in an acceptance run.",
        "**The worker fetches from the gateway machine's internet address**, your home connection: a real site's block lands there.",
        "**A push to items-core's `main` deploys everything on it** once the stack exists."
      ]
    },
    "Deferred, not in this list: flush and snapshot tuning, notification coalescing, a polished multi-worker launcher, dropping the unused token columns and renaming the stop column (`revoked_at`), and browser-provider and obstacle work."
  ],
  "epics": [
    {
      "id": "E2",
      "title": "Deploy the direct worker to GCP and accept it",
      "description": "Milestone 3 of the worker migration: the gateway on Cloud Run and one direct worker with its browser on a GCE VM, both on Cloud SQL, checked in cloud dev until the migration is complete. Closed on 2026-10-16: Google Cloud is dropped, and E4 deploys items-core on the gateway instead; the open tickets are cancelled, each naming where its work went.",
      "features": [
        {
          "id": "IC-5",
          "title": "Measure and budget Cloud SQL connections for the direct worker",
          "description": "Count every pool and listener that the gateway, the worker, the migration step and operators open, and keep the sum under Cloud SQL's limit. The plan's first Milestone 3 step.",
          "status": "Planned",
          "statusNote": "Closed for the gateway plan (E4) on 2026-10-16: the budget doc (IC-5.1) and the Terraform flag (IC-5.2, never applied) are done; the census moved to IC-20.1.",
          "where": [
            {
              "repo": "items-core",
              "part": "docs/workflow/deploy.md"
            },
            {
              "repo": "items-infrastructure",
              "part": "modules/db/items-postgresql"
            },
            {
              "repo": "gcp",
              "part": "Cloud SQL items-postgres-dev"
            }
          ],
          "today": [
            "`docs/workflow/deploy.md` (\"Connection budget\") names every term: the gateway's 2 pools of 6 plus 2 `LISTEN`s, doubled during a rollout; the worker's pool of 6 plus 4; the migration step 1; an operator reserve of 5; the superuser reserve of 3. Total 47 of 50.",
            "Every connection carries an `application_name` (`items-gateway:console`, `items-worker:<bootId>:lease` …), so a census can name it. The names in the code match the doc's table.",
            "items-infrastructure's `bbendeliani/direct-worker` sets `max_connections` to 50. Cloud dev still runs the tier's default of 25.",
            "`superuser_reserved_connections` is assumed to be 3 and marked \"measure\". Nobody has taken the census on cloud dev."
          ],
          "plan": [
            {
              "id": "IC-5.1",
              "title": "Write the connection budget into `docs/workflow/deploy.md`",
              "description": "The budget's formula and terms, the census query, and which process opens each named connection. Commits `612a2eb0`, `3a0dd6fb` (the worker's four extra connections) and `687a3cc8` (names the gateway's run-changes listener and the migration connection).",
              "done": true
            },
            {
              "id": "IC-5.2",
              "title": "Set Cloud SQL's `max_connections` to 50 and the fleet to one worker",
              "description": "`modules/db/items-postgresql` raises the flag from 25 to 50 (`2ad24b0`, items-infrastructure). The fleet limit is the worker count in Terraform: one VM with one worker container (`0e8f27e`). Both sit on the unmerged `bbendeliani/direct-worker`; IC-8.5 applies them.",
              "done": true
            },
            {
              "id": "IC-5.3",
              "title": "Take the connection census on cloud dev before the cutover",
              "description": "Run `SHOW max_connections`, `SHOW superuser_reserved_connections` and the `pg_stat_activity` count by `application_name` from `deploy.md`, with cloud dev idle. Correct the budget if the reserve or today's usage differs. Needs Cloud SQL access. Cancelled on 2026-10-16, when Google Cloud was dropped: moved to the gateway plan as IC-20.1, the census on the gateway's shared Postgres.",
              "done": false,
              "cancelled": true,
              "byYou": true
            }
          ]
        },
        {
          "id": "IC-6",
          "title": "Define the worker's name, browser, images, credentials and storage in Terraform",
          "description": "The plan's second step: settle the deployment-owned worker name, where the browser runs, the image pipeline, credentials and storage permissions, and check who still reads `PUBLIC_API_URL` before removing it.",
          "status": "Planned",
          "statusNote": "Closed for the gateway plan (E4) on 2026-10-16: IC-6.1 to IC-6.5 are done, on items-infrastructure's unmerged branch and in items-core; IC-6.6 moved to IC-17.1, and IC-6.7 was dropped.",
          "where": [
            {
              "repo": "items-infrastructure",
              "part": "modules/services/worker, modules/networks/items-vpc, modules/secrets, modules/services"
            },
            {
              "repo": "items-core",
              "part": "docker/worker, docs/workflow/worker-role.sql"
            }
          ],
          "today": {
            "text": "The Terraform follows items-core as it was on 2026-09-23. The plan is behind the code in three places:",
            "items": [
              "`de0d48aa` (2026-09-24) made `STORAGE_PROVIDER` choose `gcs`, defaulting to `local`, and refuses a `GCS_BUCKET` that no store uses. The branch sets only `GCS_BUCKET`, on the gateway (`modules/services/main.tf`) and on the VM (`modules/services/worker/cloud-init.yaml.tftpl`). So today's gateway and worker would refuse to boot. `deploy.md` already lists `STORAGE_PROVIDER=gcs`.",